keyword,current_pages,coverage,content_gap,recommended_action,priority,top_serp_links,search_volume_estimate,intent
"D1 error","/cloudflare-workers-development-guide.html (D1 section); build/setup-clodo.ps1; various blog mentions","Partial","No dedicated troubleshooting page listing D1 error codes, causes, and fixes","Create `/d1-errors/` troubleshooting page with FAQ/error list, reproducible examples, and JSON-LD FAQ schema; add internal links from D1 docs and blog posts","High","https://developers.cloudflare.com/d1/; https://developers.cloudflare.com/d1/observability/debug-d1/#error-list; https://stackoverflow.com/questions/tagged/cloudflare-d1","estimate: 1k–4k/mo","Troubleshooting / Error resolution (high intent)"
"Wrangler multi-tenant","/multi-tenant-saas.html (Multi-Tenant SaaS guide); BEST_PRACTICES_AUDIT.md","Partial","Needs concrete Wrangler env & config examples for multi-tenant setups (bindings, d1 per-tenant patterns)","Expand multi-tenant page with Wrangler config samples, env flags, migrations, and HowTo schema; include code snippets and a ‘pattern library’","High","https://developers.cloudflare.com/workers/wrangler/configuration/; https://developers.cloudflare.com/workers/wrangler/environments/","(TBD) ~500-2k/mo","How-to / Implementation (high intent)"
"Workers authentication help","/cloudflare-workers-guide.html (auth mentions); examples/basic-auth; examples/auth-with-headers","Partial","No single authoritative auth guide covering JWT, OAuth, Cloudflare Access, Turnstile, and session strategies","Create `/workers-auth/` guide: Basic auth, JWT, OAuth flows, Access integration, best practices, code snippets, QAPage schema","High","https://developers.cloudflare.com/workers/examples/basic-auth/; https://developers.cloudflare.com/workers/examples/auth-with-headers/","(TBD) ~1-4k/mo","How-to / Secure implementation (high intent)"
"Cloudflare Workers boilerplate","/clodo-starter-template/; /clodo-web-starter/; Cloudflare templates (external)","Partial","No single landing page that compares and showcases starter templates and quick-starts","Create `/workers-boilerplate/` showcase with template comparisons, CLI quickstarts, deploy snippets, and `SoftwareSourceCode` schema","Medium","https://developers.cloudflare.com/workers/get-started/quickstarts/; https://github.com/cloudflare/templates","(TBD) ~500-2k/mo","Discovery / Quickstart (intent: find starter code)"
"Workers cold start Nextjs","/what-is-cloudflare-workers.html (cold start benefits); Next.js deployment docs (Cloudflare Pages)","Partial","Lacks a focused Next.js cold-start guide that compares deployment options and optimization steps","Create `/workers-nextjs-cold-start/` performance guide: explain isolates, Next.js deployment patterns, benchmark data, mitigations, and examples","Medium","https://developers.cloudflare.com/workers/learning/how-workers-works/#cold-starts; https://developers.cloudflare.com/pages/framework-guides/nextjs/","(TBD) ~200-1k/mo","Performance / Architecture (intent: optimize deployments)"
